Restaurant ID,Restaurant Name,Country,City,User Rating Votes,User Aggregate Rating,Cuisines,Event Data
18800810,The Black Pearl,India,Chennai,1435,4.6,"North Indian, European, Mediterranean, Continental, BBQ","[{'event': {'event_id': 333451, 'friendly_start_date': '01 April', 'friendly_end_date': '31 March, 2020', 'friendly_timing_str': 'Monday, 1st April - Tuesday, 31st March', 'start_date': '2019-04-01', 'end_date': '2020-03-31', 'end_time': '23:00:00', 'start_time': '12:00:00', 'is_active': 1, 'date_added': '2019-04-01 00:49:43', 'photos': [{'photo': {'url': 'https://b.zmtcdn.com/data/zomato_events/photos/d3c/6c736ceb55aa545c4e1f2af77eedcd3c_1554060000.jpeg', 'thumb_url': 'https://b.zmtcdn.com/data/zomato_events/photos/d3c/6c736ceb55aa545c4e1f2af77eedcd3c_1554060000.jpeg?fit=around%7C100%3A100&crop=100%3A100%3B%2A%2C%2A', 'order': 0, 'md5sum': '6c736ceb55aa545c4e1f2af77eedcd3c', 'id': 449195, 'photo_id': 449195, 'uuid': 1554059998423191, 'type': 'NORMAL'}}], 'restaurants': [], 'is_valid': 1, 'share_url': 'http://www.zoma.to/r/0', 'show_share_url': 0, 'title': 'Early Bird Offer on Buffet!', 'description': 'Wed - Sunday - 6-30pm to 7-30pm', 'display_time': '12:00 pm - 11:00 pm', 'display_date': '01 April - 31 March', 'is_end_time_set': 1, 'disclaimer': 'Restaurants are solely responsible for the service; availability and quality of the events including all or any cancellations/ modifications/ complaints.', 'event_category': 0, 'event_category_name': '', 'book_link': '', 'types': [{'name': 'Promos', 'color': '#F96C6A'}], 'share_data': {'should_show': 0}}}, {'event': {'event_id': 333452, 'friendly_start_date': '01 April', 'friendly_end_date': '31 March, 2020', 'friendly_timing_str': 'Monday, 1st April - Tuesday, 31st March', 'start_date': '2019-04-01', 'end_date': '2020-03-31', 'end_time': '23:00:00', 'start_time': '12:00:00', 'is_active': 1, 'date_added': '2019-04-01 00:52:17', 'photos': [{'photo': {'url': 'https://b.zmtcdn.com/data/zomato_events/photos/2a6/63e054b62fcfe8112849cdb1258c62a6_1554060137.jpeg', 'thumb_url': 'https://b.zmtcdn.com/data/zomato_events/photos/2a6/63e054b62fcfe8112849cdb1258c62a6_1554060137.jpeg?fit=around%7C100%3A100&crop=100%3A100%3B%2A%2C%2A', 'order': 0, 'md5sum': '63e054b62fcfe8112849cdb1258c62a6', 'id': 449196, 'photo_id': 449196, 'uuid': 1554060133051536, 'type': 'NORMAL'}}, {'photo': {'url': 'https://b.zmtcdn.com/data/zomato_events/photos/36b/baa350b182a0203a2a178b0d0669e36b_1554060137.jpeg', 'thumb_url': 'https://b.zmtcdn.com/data/zomato_events/photos/36b/baa350b182a0203a2a178b0d0669e36b_1554060137.jpeg?fit=around%7C100%3A100&crop=100%3A100%3B%2A%2C%2A', 'order': 1, 'md5sum': 'baa350b182a0203a2a178b0d0669e36b', 'id': 449197, 'photo_id': 449197, 'uuid': 1554060133204267, 'type': 'NORMAL'}}], 'restaurants': [], 'is_valid': 1, 'share_url': 'http://www.zoma.to/r/0', 'show_share_url': 0, 'title': 'Corporate Offers at The Black Pearl Chennai', 'description': 'Get a 10%discount on Total Bill of a group booking of 10 or more people \nCome 10, Pay for 9 on Buffets \n\n', 'display_time': '12:00 pm - 11:00 pm', 'display_date': '01 April - 31 March', 'is_end_time_set': 1, 'disclaimer': 'Restaurants are solely responsible for the service; availability and quality of the events including all or any cancellations/ modifications/ complaints.', 'event_category': 0, 'event_category_name': '', 'book_link': '', 'types': [{'name': 'Corporate Discounts', 'color': '#E23744'}], 'share_data': {'should_show': 0}}}, {'event': {'event_id': 333454, 'friendly_start_date': '01 April', 'friendly_end_date': '31 March, 2020', 'friendly_timing_str': 'Monday, 1st April - Tuesday, 31st March', 'start_date': '2019-04-01', 'end_date': '2020-03-31', 'end_time': '23:00:00', 'start_time': '12:00:00', 'is_active': 1, 'date_added': '2019-04-01 00:53:54', 'photos': [{'photo': {'url': 'https://b.zmtcdn.com/data/zomato_events/photos/dce/b9709e5ea858d44222bedcfed3f62dce_1554060234.jpeg', 'thumb_url': 'https://b.zmtcdn.com/data/zomato_events/photos/dce/b9709e5ea858d44222bedcfed3f62dce_1554060234.jpeg?fit=around%7C100%3A100&crop=100%3A100%3B%2A%2C%2A', 'order': 0, 'md5sum': 'b9709e5ea858d44222bedcfed3f62dce', 'id': 449198, 'photo_id': 449198, 'uuid': 1554060181777566, 'type': 'NORMAL'}}, {'photo': {'url': 'https://b.zmtcdn.com/data/zomato_events/photos/002/e9c6823f503faabcdd1f7bdac2c6c002_1554060234.jpeg', 'thumb_url': 'https://b.zmtcdn.com/data/zomato_events/photos/002/e9c6823f503faabcdd1f7bdac2c6c002_1554060234.jpeg?fit=around%7C100%3A100&crop=100%3A100%3B%2A%2C%2A', 'order': 1, 'md5sum': 'e9c6823f503faabcdd1f7bdac2c6c002', 'id': 449199, 'photo_id': 449199, 'uuid': 1554060181862742, 'type': 'NORMAL'}}], 'restaurants': [], 'is_valid': 1, 'share_url': 'http://www.zoma.to/r/0', 'show_share_url': 0, 'title': 'Special offers for Senior citizens and Complimentary mocktail per diner!', 'description': 'The best offers suiting all different requirements\n', 'display_time': '12:00 pm - 11:00 pm', 'display_date': '01 April - 31 March', 'is_end_time_set': 1, 'disclaimer': 'Restaurants are solely responsible for the service; availability and quality of the events including all or any cancellations/ modifications/ complaints.', 'event_category': 0, 'event_category_name': '', 'book_link': '', 'types': [{'name': 'Promos', 'color': '#F96C6A'}], 'share_data': {'should_show': 0}}}, {'event': {'event_id': 336453, 'friendly_start_date': '07 April', 'friendly_end_date': '30 May', 'friendly_timing_str': 'Sunday, 7th April - Thursday, 30th May', 'start_date': '2019-04-07', 'end_date': '2019-05-30', 'end_time': '21:00:00', 'start_time': '20:00:00', 'is_active': 1, 'date_added': '2019-04-07 19:19:34', 'photos': [{'photo': {'url': 'https://b.zmtcdn.com/data/zomato_events/photos/ea4/907e5845ef5221dc71c559578d038ea4_1554645083.jpg', 'thumb_url': 'https://b.zmtcdn.com/data/zomato_events/photos/ea4/907e5845ef5221dc71c559578d038ea4_1554645083.jpg?fit=around%7C100%3A100&crop=100%3A100%3B%2A%2C%2A', 'order': 0, 'md5sum': '907e5845ef5221dc71c559578d038ea4', 'id': 453380, 'photo_id': 453380, 'uuid': 1554645068716165, 'type': 'NORMAL'}}], 'restaurants': [], 'is_valid': 1, 'share_url': 'http://www.zoma.to/r/0', 'show_share_url': 0, 'title': 'Support Namma CSK', 'description': 'Watch CSK match live and get 10% discount on food bill. T&C apply', 'display_time': '08:00 pm - 09:00 pm', 'display_date': '07 April - 30 May', 'is_end_time_set': 1, 'disclaimer': 'Restaurants are solely responsible for the service; availability and quality of the events including all or any cancellations/ modifications/ complaints.', 'event_category': 0, 'event_category_name': '', 'book_link': '', 'types': [{'name': 'Promos', 'color': '#F96C6A'}], 'share_data': {'should_show': 0}}}, {'event': {'event_id': 337249, 'friendly_start_date': '14 April', 'friendly_end_date': '14 April', 'friendly_timing_str': 'Sunday, 14th April', 'start_date': '2019-04-14', 'end_date': '2019-04-14', 'end_time': '23:00:00', 'start_time': '12:00:00', 'is_active': 1, 'date_added': '2019-04-09 15:40:59', 'photos': [{'photo': {'url': 'https://b.zmtcdn.com/data/zomato_events/photos/34b/2ca35fca44e8e154a940b4ad46af634b_1554804659.jpg', 'thumb_url': 'https://b.zmtcdn.com/data/zomato_events/photos/34b/2ca35fca44e8e154a940b4ad46af634b_1554804659.jpg?fit=around%7C100%3A100&crop=100%3A100%3B%2A%2C%2A', 'order': 0, 'md5sum': '2ca35fca44e8e154a940b4ad46af634b', 'id': 454466, 'photo_id': 454466, 'uuid': 1554804516062208, 'type': 'NORMAL'}}, {'photo': {'url': 'https://b.zmtcdn.com/data/zomato_events/photos/7d6/388c741ca91a34e4bcc9f67bf764e7d6_1554804659.jpg', 'thumb_url': 'https://b.zmtcdn.com/data/zomato_events/photos/7d6/388c741ca91a34e4bcc9f67bf764e7d6_1554804659.jpg?fit=around%7C100%3A100&crop=100%3A100%3B%2A%2C%2A', 'order': 1, 'md5sum': '388c741ca91a34e4bcc9f67bf764e7d6', 'id': 454467, 'photo_id': 454467, 'uuid': 1554804521161568, 'type': 'NORMAL'}}], 'restaurants': [], 'is_valid': 1, 'share_url': 'http://www.zoma.to/r/0', 'show_share_url': 0, 'title': 'Tamil Puthandu in Pirates Style', 'description': ""Enjoy Tamil Nadu's traditional dishes on Tamil New Year at THE BLACK PEARL, CHENNAI"", 'display_time': '12:00 pm - 11:00 pm', 'display_date': '14 April', 'is_end_time_set': 1, 'disclaimer': 'Restaurants are solely responsible for the service; availability and quality of the events including all or any cancellations/ modifications/ complaints.', 'event_category': 0, 'event_category_name': '', 'book_link': '', 'types': [], 'share_data': {'should_show': 0}}}]"
71443,Palmshore,India,Chennai,3198,4.5,"Seafood, Biryani, Kebab, North Indian, Chinese, Arabian, BBQ, Juices","[{'event': {'event_id': 329269, 'friendly_start_date': '22 March', 'friendly_end_date': '30 April', 'friendly_timing_str': 'Friday, 22nd March - Tuesday, 30th April', 'start_date': '2019-03-22', 'end_date': '2019-04-30', 'end_time': '12:00:00', 'start_time': '11:00:00', 'is_active': 1, 'date_added': '2019-03-22 10:29:56', 'photos': [{'photo': {'url': 'https://b.zmtcdn.com/data/zomato_events/photos/810/f8fc852a354dbfa87faac0ca6c899810_1553230796.jpg', 'thumb_url': 'https://b.zmtcdn.com/data/zomato_events/photos/810/f8fc852a354dbfa87faac0ca6c899810_1553230796.jpg?fit=around%7C100%3A100&crop=100%3A100%3B%2A%2C%2A', 'order': 0, 'md5sum': 'f8fc852a354dbfa87faac0ca6c899810', 'id': 443473, 'photo_id': 443473, 'uuid': 1553230783613370, 'type': 'NORMAL'}}], 'restaurants': [], 'is_valid': 1, 'share_url': 'http://www.zoma.to/r/0', 'show_share_url': 0, 'title': 'Buffet', 'description': 'Buffet', 'display_time': '11:00 am - 12:00 pm', 'display_date': '22 March - 30 April', 'is_end_time_set': 1, 'disclaimer': 'Restaurants are solely responsible for the service; availability and quality of the events including all or any cancellations/ modifications/ complaints.', 'event_category': 0, 'event_category_name': '', 'book_link': '', 'types': [], 'share_data': {'should_show': 0}}}]"
18801082,Farzi CafÃ©,India,Lucknow,298,4.6,Modern Indian,"[{'event': {'event_id': 331036, 'friendly_start_date': '26 March', 'friendly_end_date': '30 May', 'friendly_timing_str': 'Tuesday, 26th March - Thursday, 30th May', 'start_date': '2019-03-26', 'end_date': '2019-05-30', 'end_time': '13:00:00', 'start_time': '12:00:00', 'is_active': 1, 'date_added': '2019-03-26 11:33:44', 'photos': [], 'restaurants': [], 'is_valid': 1, 'share_url': 'http://www.zoma.to/r/0', 'show_share_url': 0, 'title': 'CRICKET FEVER - 2019', 'description': 'This IPL season, come and show your love to the team you support.\nEnjoy the match on giant live screen with exciting offers of food & beverages.', 'display_time': '12:00 pm - 01:00 pm', 'display_date': '26 March - 30 May', 'is_end_time_set': 1, 'disclaimer': 'Restaurants are solely responsible for the service; availability and quality of the events including all or any cancellations/ modifications/ complaints.', 'event_category': 0, 'event_category_name': '', 'book_link': '', 'types': [], 'share_data': {'should_show': 0}}}, {'event': {'event_id': 335804, 'friendly_start_date': '13 April', 'friendly_end_date': '14 April', 'friendly_timing_str': 'Saturday, 13th April - Sunday, 14th April', 'start_date': '2019-04-13', 'end_date': '2019-04-14', 'end_time': '00:30:00', 'start_time': '21:30:00', 'is_active': 1, 'date_added': '2019-04-05 14:35:53', 'photos': [], 'restaurants': [], 'is_valid': 1, 'share_url': 'http://www.zoma.to/r/0', 'show_share_url': 0, 'title': 'Saturday Night with DJ SAAD!', 'description': ""Get ready to groove on DJ Saad's music on Saturday (13th April. 2019) at Farzi Cafe, Lucknow!\n\nFor table reservations, call : +91 90766 00211 / 12\n\n#SaturdayNight #Saturday #Live #Farzi #FarziCafeLKO #GetFarzified"", 'display_time': '09:30 pm - 12:30 am', 'display_date': '13 April - 14 April', 'is_end_time_set': 1, 'disclaimer': 'Restaurants are solely responsible for the service; availability and quality of the events including all or any cancellations/ modifications/ complaints.', 'event_category': 0, 'event_category_name': '', 'book_link': '', 'types': [], 'share_data': {'should_show': 0}}}, {'event': {'event_id': 335809, 'friendly_start_date': '14 April', 'friendly_end_date': '15 April', 'friendly_timing_str': 'Sunday, 14th April - Monday, 15th April', 'start_date': '2019-04-14', 'end_date': '2019-04-15', 'end_time': '00:30:00', 'start_time': '21:30:00', 'is_active': 1, 'date_added': '2019-04-05 14:37:30', 'photos': [{'photo': {'url': 'https://b.zmtcdn.com/data/zomato_events/photos/814/df682d8402a8276f22dd32b0cf180814_1554455250.jpeg', 'thumb_url': 'https://b.zmtcdn.com/data/zomato_events/photos/814/df682d8402a8276f22dd32b0cf180814_1554455250.jpeg?fit=around%7C100%3A100&crop=100%3A100%3B%2A%2C%2A', 'order': 0, 'md5sum': 'df682d8402a8276f22dd32b0cf180814', 'id': 452334, 'photo_id': 452334, 'uuid': 1554455237947602, 'type': 'NORMAL'}}], 'is_valid': 1, 'share_url': 'http://www.zoma.to/r/0', 'show_share_url': 0, 'title': 'Sunday Night with Indie Street Rockers!', 'description': 'One of the most renowned music bands in town is performing at Farzi Cafe Lucknow once again!! Make some noise for them. Let your Sunday be a fabulous one. Get your friends along!\n\n14th April, 2019  |  9:30 PM onwards\n\nFor table reservations, call : +91 9076600211/ 12', 'display_time': '09:30 pm - 12:30 am', 'display_date': '14 April - 15 April', 'is_end_time_set': 1, 'disclaimer': 'Restaurants are solely responsible for the service; availability and quality of the events including all or any cancellations/ modifications/ complaints.', 'is_zomato_event': True, 'event_category': 0, 'event_category_name': '', 'url': 'https://www.zomato.com/mobileEventCards.php?display_mode=detail&event_id=335809&event_name=Sunday+Night+with+Indie+Street+Rockers%21', 'book_link': '', 'types': [], 'share_data': {'should_show': 0}}}]"
18971277,Cafe Repertwahr,India,Lucknow,131,4.1,"North Indian, Chinese, Continental, Italian, Seafood, Salad","[{'event': {'event_id': 332493, 'friendly_start_date': '28 March', 'friendly_end_date': '26 May', 'friendly_timing_str': 'Thursday, 28th March - Sunday, 26th May', 'start_date': '2019-03-28', 'end_date': '2019-05-26', 'end_time': '23:00:00', 'start_time': '11:00:00', 'is_active': 1, 'date_added': '2019-03-28 22:41:49', 'photos': [{'photo': {'url': 'https://b.zmtcdn.com/data/zomato_events/photos/575/d460f0ddb1ca69ffac4e8b04550af575_1553793124.jpg', 'thumb_url': 'https://b.zmtcdn.com/data/zomato_events/photos/575/d460f0ddb1ca69ffac4e8b04550af575_1553793124.jpg?fit=around%7C100%3A100&crop=100%3A100%3B%2A%2C%2A', 'order': 0, 'md5sum': 'd460f0ddb1ca69ffac4e8b04550af575', 'id': 447869, 'photo_id': 447869, 'uuid': 1553793121918569, 'type': 'NORMAL'}}], 'restaurants': [], 'is_valid': 1, 'share_url': 'http://www.zoma.to/r/0', 'show_share_url': 0, 'title': 'Enjoy live IPL with FBL', 'description': 'This IPL Season, Cafe Repertwahr is celebrating the Food Premier League!\r\nWatch your favourite teams battle it out on the field while we serve you some special dishes from their region!\r\nBe it Rajasthan Royals and Dal Baati Churma versus Kings XI Punjab and Dal Makhani; or Sunrisers Hyderabad and Murg Hyderabadi versus Delhi Capitals and Murg Makhani, it is going to be the ultimate IPL experience!\r\nOnly at Cafe Repertwahr!\r\nAddress: A-2, Kala Niketan, Maruti Puram, Indira Nagar, Lucknow\r\nBook your table! Call: 9170573793', 'display_time': '11:00 am - 11:00 pm', 'display_date': '28 March - 26 May', 'is_end_time_set': 1, 'disclaimer': 'Restaurants are solely responsible for the service; availability and quality of the events including all or any cancellations/ modifications/ complaints.', 'event_category': 0, 'event_category_name': '', 'book_link': '', 'types': [], 'share_data': {'should_show': 0}}}]"
18439027,Skyhilton,India,Lucknow,750,4.1,"North Indian, Chinese, Continental","[{'event': {'event_id': 336239, 'friendly_start_date': '06 April', 'friendly_end_date': '13 April', 'friendly_timing_str': 'Saturday, 6th April - Saturday, 13th April', 'start_date': '2019-04-06', 'end_date': '2019-04-13', 'end_time': '23:59:59', 'start_time': '19:00:00', 'is_active': 1, 'date_added': '2019-04-06 17:10:08', 'photos': [{'photo': {'url': 'https://b.zmtcdn.com/data/zomato_events/photos/142/03b08e1096a645facf19bec8f7124142_1554550960.jpg', 'thumb_url': 'https://b.zmtcdn.com/data/zomato_events/photos/142/03b08e1096a645facf19bec8f7124142_1554550960.jpg?fit=around%7C100%3A100&crop=100%3A100%3B%2A%2C%2A', 'order': 0, 'md5sum': '03b08e1096a645facf19bec8f7124142', 'id': 452982, 'photo_id': 452982, 'uuid': 50937039188, 'type': 'FEATURED'}}], 'restaurants': [], 'is_valid': 1, 'share_url': 'http://www.zoma.to/r/0', 'show_share_url': 0, 'title': 'Unlimited Navratri Chaat', 'description': ""As maa durga pave way to your home,\ncelebrate the auspicious days of Navratri at Skyhilton with special 'Navratri Chaat' at just Rs 199/-"", 'display_time': '07:00 pm onwards', 'display_date': '06 April - 13 April', 'is_end_time_set': 0, 'disclaimer': 'Restaurants are solely responsible for the service; availability and quality of the events including all or any cancellations/ modifications/ complaints.', 'event_category': 1, 'event_category_name': '', 'book_link': '', 'types': [], 'share_data': {'should_show': 0}}}]"
18748726,The Night Jar,India,Jaipur,851,4.7,"North Indian, Continental, Chinese","[{'event': {'event_id': 328996, 'friendly_start_date': '23 March', 'friendly_end_date': '19 May', 'friendly_timing_str': 'Saturday, 23rd March - Sunday, 19th May', 'start_date': '2019-03-23', 'end_date': '2019-05-19', 'end_time': '23:00:00', 'start_time': '20:00:00', 'is_active': 1, 'date_added': '2019-03-20 22:24:02', 'photos': [{'photo': {'url': 'https://b.zmtcdn.com/data/zomato_events/photos/c19/15214588f9c5c7635b22d57ea026fc19_1553100842.jpg', 'thumb_url': 'https://b.zmtcdn.com/data/zomato_events/photos/c19/15214588f9c5c7635b22d57ea026fc19_1553100842.jpg?fit=around%7C100%3A100&crop=100%3A100%3B%2A%2C%2A', 'order': 0, 'md5sum': '15214588f9c5c7635b22d57ea026fc19', 'id': 443081, 'photo_id': 443081, 'uuid': 839979919, 'type': 'FEATURED'}}], 'restaurants': [], 'is_valid': 1, 'share_url': 'http://www.zoma.to/r/0', 'show_share_url': 0, 'title': 'IPL Live Screening', 'description': 'Live Streaming of IPL matches available at The Night Jar', 'display_time': '08:00 pm - 11:00 pm', 'display_date': '23 March - 19 May', 'is_end_time_set': 1, 'disclaimer': 'Restaurants are solely responsible for the service; availability and quality of the events including all or any cancellations/ modifications/ complaints.', 'event_category': 1, 'event_category_name': '', 'book_link': '', 'types': [{'name': 'Live Sports Screening', 'color': '#0DA314'}], 'share_data': {'should_show': 0}}}, {'event': {'event_id': 328614, 'friendly_start_date': '25 March', 'friendly_end_date': '31 May', 'friendly_timing_str': 'Monday, 25th March - Friday, 31st May', 'start_date': '2019-03-25', 'end_date': '2019-05-31', 'end_time': '23:58:00', 'start_time': '12:00:00', 'is_active': 1, 'date_added': '2019-03-20 15:02:06', 'photos': [{'photo': {'url': 'https://b.zmtcdn.com/data/zomato_events/photos/206/368820d2325f87659ebbfbe78c212206_1553074326.jpg', 'thumb_url': 'https://b.zmtcdn.com/data/zomato_events/photos/206/368820d2325f87659ebbfbe78c212206_1553074326.jpg?fit=around%7C100%3A100&crop=100%3A100%3B%2A%2C%2A', 'order': 0, 'md5sum': '368820d2325f87659ebbfbe78c212206', 'id': 442652, 'photo_id': 442652, 'uuid': 7432381630, 'type': 'FEATURED'}}], 'restaurants': [], 'is_valid': 1, 'share_url': 'http://www.zoma.to/r/0', 'show_share_url': 0, 'title': 'IPL SPECIALS', 'description': 'Catch Live Cricketing Action With Amazing Offers Only At The Night Jar....', 'display_time': '12:00 pm - 11:58 pm', 'display_date': '25 March - 31 May', 'is_end_time_set': 1, 'disclaimer': 'Restaurants are solely responsible for the service; availability and quality of the events including all or any cancellations/ modifications/ complaints.', 'event_category': 1, 'event_category_name': '', 'book_link': '', 'types': [{'name': 'Live Sports Screening', 'color': '#0DA314'}], 'share_data': {'should_show': 0}}}, {'event': {'event_id': 336485, 'friendly_start_date': '10 April', 'friendly_end_date': '10 April', 'friendly_timing_str': 'Wednesday, 10th April', 'start_date': '2019-04-10', 'end_date': '2019-04-10', 'end_time': '23:00:00', 'start_time': '20:00:00', 'is_active': 1, 'date_added': '2019-04-07 21:10:19', 'photos': [{'photo': {'url': 'https://b.zmtcdn.com/data/zomato_events/photos/104/70ee0cc803cdbdde1ab8bb92d3315104_1554742926.jpg', 'thumb_url': 'https://b.zmtcdn.com/data/zomato_events/photos/104/70ee0cc803cdbdde1ab8bb92d3315104_1554742926.jpg?fit=around%7C100%3A100&crop=100%3A100%3B%2A%2C%2A', 'order': 0, 'md5sum': '70ee0cc803cdbdde1ab8bb92d3315104', 'id': 454095, 'photo_id': 454095, 'uuid': 42921932676, 'type': 'FEATURED'}}], 'restaurants': [], 'is_valid': 1, 'share_url': 'http://www.zoma.to/r/0', 'show_share_url': 0, 'title': 'Wow Wednesday', 'description': 'Enjoy your Wednesday evenings with live performance only at The Night Jar', 'display_time': '08:00 pm - 11:00 pm', 'display_date': '10 April', 'is_end_time_set': 1, 'disclaimer': 'Restaurants are solely responsible for the service; availability and quality of the events including all or any cancellations/ modifications/ complaints.', 'event_category': 1, 'event_category_name': '', 'book_link': '', 'types': [{'name': 'Promos', 'color': '#F96C6A'}], 'share_data': {'should_show': 0}}}]"
102695,Thali and More,India,Jaipur,1820,4.3,"North Indian, South Indian, Italian, Chinese","[{'event': {'event_id': 334436, 'friendly_start_date': '03 April', 'friendly_end_date': '30 April', 'friendly_timing_str': 'Wednesday, 3rd April - Tuesday, 30th April', 'start_date': '2019-04-03', 'end_date': '2019-04-30', 'end_time': '11:30:00', 'start_time': '08:00:00', 'is_active': 1, 'date_added': '2019-04-02 17:31:11', 'photos': [{'photo': {'url': 'https://b.zmtcdn.com/data/zomato_events/photos/d93/1ff671abaef07622a8b530b09fff9d93_1554206574.jpeg', 'thumb_url': 'https://b.zmtcdn.com/data/zomato_events/photos/d93/1ff671abaef07622a8b530b09fff9d93_1554206574.jpeg?fit=around%7C100%3A100&crop=100%3A100%3B%2A%2C%2A', 'order': 0, 'md5sum': '1ff671abaef07622a8b530b09fff9d93', 'id': 450581, 'photo_id': 450581, 'uuid': 1554206640504715, 'type': 'NORMAL'}}], 'restaurants': [], 'is_valid': 1, 'share_url': 'http://www.zoma.to/r/0', 'show_share_url': 0, 'title': 'GOOD MORNING JAIPUR', 'description': 'All Happiness depends upon a leisurely breakfast.\nStart your Morning with healthy Breakfast. Special menu would be served. \n\nKindly Note: No loyalty programs wont be entertained as regular menu wont be served everyday morning from 8:00 am to 11:30 am.', 'display_time': '08:00 am - 11:30 am', 'display_date': '03 April - 30 April', 'is_end_time_set': 1, 'disclaimer': 'Restaurants are solely responsible for the service; availability and quality of the events including all or any cancellations/ modifications/ complaints.', 'event_category': 0, 'event_category_name': '', 'book_link': '', 'types': [{'name': 'Special Menu', 'color': '#F96C6A'}], 'share_data': {'should_show': 0}}}]"
18882467,Makeba - The Lounge Cafe,India,Ahmedabad,368,4.2,"Cafe, Italian, Mexican, Healthy Food","[{'event': {'event_id': 327296, 'friendly_start_date': '23 March', 'friendly_end_date': '19 May', 'friendly_timing_str': 'Saturday, 23rd March - Sunday, 19th May', 'start_date': '2019-03-23', 'end_date': '2019-05-19', 'end_time': '23:55:00', 'start_time': '20:00:00', 'is_active': 1, 'date_added': '2019-03-17 20:32:14', 'photos': [{'photo': {'url': 'https://b.zmtcdn.com/data/zomato_events/photos/92a/89eb96918348080d937a8d033939992a_1552834955.jpg', 'thumb_url': 'https://b.zmtcdn.com/data/zomato_events/photos/92a/89eb96918348080d937a8d033939992a_1552834955.jpg?fit=around%7C100%3A100&crop=100%3A100%3B%2A%2C%2A', 'order': 0, 'md5sum': '89eb96918348080d937a8d033939992a', 'id': 441032, 'photo_id': 441032, 'uuid': 34942213228, 'type': 'FEATURED'}}], 'restaurants': [], 'is_valid': 1, 'share_url': 'http://www.zoma.to/r/0', 'show_share_url': 0, 'title': 'Live Sports Screening @Makeba The Lounge Cafe', 'description': 'Live Screening of IPL 2019 On 2 Big Screens at Open to Sky Rooftop Seating With Amazing Ambience and Great Food.', 'display_time': '08:00 pm - 11:55 pm', 'display_date': '23 March - 19 May', 'is_end_time_set': 1, 'disclaimer': 'Restaurants are solely responsible for the service; availability and quality of the events including all or any cancellations/ modifications/ complaints.', 'event_category': 0, 'event_category_name': '', 'book_link': '', 'types': [{'name': 'Live Cricket Screening 2019', 'color': '#0DA314'}, {'name': 'Live Sports Screening', 'color': '#0DA314'}], 'share_data': {'should_show': 0}}}]"
